Title,Author,Quantity,Genre
"""Stand Back"", Said the Elephant, ""I'm Going to Sneeze""",Patricia Thomas,1,General Knowledge
(george),E.L. Konigsburg,2,General Knowledge
... And Now Miguel,Joseph Krumgold,1,General Knowledge
10 things i know about elephants,wendy wax,1,General Knowledge
100 Most Disgusting Things On The Planet,Anna Claybourne,1,Science
100 People who Changed America,Russell Freedman,1,General Knowledge
100 people Who Changed America,Russell Freedman!,1,General Knowledge
101 Back-to-School Jokes,Alan Eisenberg & Terry Hall,1,General Knowledge
101 Cool Magic Tricks,Glen Singleton,1,Arts and Recreation
101 Facts About Puppies,Julia Barnes,2,General Knowledge
101 Nutty Nature Jokes,Melvin Berger,1,General Knowledge
11 Planets A New View of the Solar System,David A. Aguilar,1,Science
115 Saintly Fun Facts,Bernadette McCarver Snyder,1,General Knowledge
12 again,sue corbett,1,General Knowledge
13 ghosts: strange but true stories,will osborne,2,Literature
150 Fun Facts Found in the Bible,Bernadette McCarver Snyder,2,Religion
1621 A New Look at Thanksgiving,Catherine O'Neill Grace,1,General Knowledge
"1934 Kit's Surprise, A Christmas Story",Valerie Tripp,3,Literature
20 Party Tricks To Amuse and Amaze Your Friends,Sophie Blackall,1,Arts and Recreation
"20,000 Leagues Under the Sea",Jules Verne,1,General Knowledge
26 fairmont avenue,tomie depaola,1,General Knowledge
26 fairmount avenue,tomie de paola,1,General Knowledge
26 Farmount Avenue,Tomie De Paola,1,General Knowledge
"43 Old Cemetery Road, Dying To Meet You",Kate Klise,1,General Knowledge
5-Minute Star Wars Stories,Disney,1,Literature
a  noverl of kingdom jackarro,cynthia voigt,1,General Knowledge
A Baby Panda is Born,Kristin Osby,1,General Knowledge
A Baby Sister for Frances,Russell Hoban,1,General Knowledge
A Bad Case of Stripes,David Shannon,1,General Knowledge
a bargain for frances,russell hoban,2,General Knowledge
A Bear Named Trouble,Marion Dane Bauer,1,General Knowledge
A Big Fat Enormous Lie,Marjorie Weinman Sharmat,1,General Knowledge
A Birthday Basket for Tia,Pat Mora,1,General Knowledge
a birthday for boots,how to be practically perfect pig,1,General Knowledge
A Birthday for Frances,Russel Hoban,1,General Knowledge
A Blizzard Year,Gretel Ehrlich,1,General Knowledge
a book about Christopher Columbus,Ruth Belou Gross,1,General Knowledge
a book about christopher columbus,ruth gross,1,General Knowledge
A Book about Planets,Betty Polisar Reigot,1,Science
A Book About Planets and Stars,Betty Polisar Reigot,1,Science
A Book About Your Skeleton,Ruth Belov Gross,1,General Knowledge
A Boy at War,Harry Mazer,1,General Knowledge
A Boy No More,Harry Mazer,2,General Knowledge
A Calendar of Festivals,Cherry Gilchrist,1,General Knowledge
a carpone does my shirts,gennifer choldenko,2,General Knowledge
A Chair for my Mother,Vera B. Williams,2,General Knowledge
A Child's Book oF Blessings,Sabrina Dearborn,1,General Knowledge
A Child's Glacier Bay,Kimberly & Hannah Corral,1,General Knowledge
A Child's Portrait of Shakespeare,Louis Burdett,1,General Knowledge
A Chirstmas Tale,Elisabeth Dami,1,Literature
A Christmas Carol,Charles Dickens,5,General Knowledge
A Christmas Treasure,Greg Hildebrandt,1,General Knowledge
A Coal Miner's Bride,Susan Campbell Bartoletti,1,General Knowledge
A Corner of the Universe,Ann M. Martin,1,General Knowledge
A Crooked kind of Perfect,Linda Urban,1,General Knowledge
A Dance of Friendship,Katherine Holabird,1,Arts and Recreation
a dark tale,ruth brown,1,Literature
A Day at the Fair,Arleta RIchardson,1,General Knowledge
A Day No Pigs Would Die,Robert Newton Peck,1,General Knowledge
A Day With Wilbur Robinson,Willaim Joyce,1,General Knowledge
A Dog Called Kitty,Bill Wallace,2,General Knowledge
A Dog's Gotta Do What a Dog's Gotta Do,Marilyn Singer,1,General Knowledge
A Drop of Water,Walter Wick,1,General Knowledge
a drop of waters,walter wick,2,General Knowledge
a fabumouse school adventure,geonimo stilton,1,General Knowledge
A Fairy Merry Christmas,Gail Herman,1,General Knowledge
A Faith Like Mine,Laura Buller,1,Religion
A Field Guide to the Wildlife of North America,Bryan Richard,1,Philosophy and Psychology
a fine start megs prairie diary,kate mcmullan,1,Literature
A Fine White Dust,Cynthia Rylant,4,General Knowledge
A First Bible Story Book,Mary Hoffman,3,Literature
a fly went by,mike mcclintock,1,General Knowledge
A Friend for a Dragon,Dav Pilkey,1,General Knowledge
a gathering of days,joan w blos,1,General Knowledge
A ghost In The House,Betty Ren Wright,1,General Knowledge
a ghost story,pam conrad,1,Literature
A Girl Named Disaster,Nancy Farmer,1,General Knowledge
A Good Night for Ghosts,Mary Pope Osborne,1,General Knowledge
A Great Day for Soccer,Quinlan B. Lee,1,Arts and Recreation
A Hero's Guide To Warriors,Deborah Murrell,2,Philosophy and Psychology
A Horse for Mandy,Mary Daniel,1,General Knowledge
A House Called Awful End,Philip Ardagh,1,General Knowledge
A House Called Awful End (Eddie Dickens Trilogy),Philip Ardagh,1,General Knowledge
A House for Hermit Crab,Eric Carme,2,General Knowledge
A Jungle Expedition,Henri Roujjeau,1,General Knowledge
A Junior Novelization,Daniela Burr,1,Literature
A Kiss for Little Bear,Else Holmelund Minarik,1,General Knowledge
A Knecklace of Raindrops,Joan Alken,1,General Knowledge
A Kwanzaa Miracle,Sharon Shavers Gayle,2,General Knowledge
A Letter for maria,Elizabeth Lindsey,1,General Knowledge
A Letter To Mrs. Roosevelt,C. Coco De Young,1,General Knowledge
A Likely Place,Paula Fox,1,General Knowledge
A Little Book of Slime,Schoolastic,1,General Knowledge
A Long Way from Chicago,Richard Peck,4,General Knowledge
a matter of pride,lucy bledsoe,1,General Knowledge
A Maze Adventure: Storming a Castle,Graham White,1,General Knowledge
A midnight Clear,Katherine Paterson,1,General Knowledge
A Monkey Grows Up,Rita Golden Gelman,1,General Knowledge
A Mother's Journey,Sandra Markle,1,General Knowledge
A Mouse Called Wolf,Dick King-Smith,1,General Knowledge
"A Nancy Drew and Hardy Boys Super Mystery, Dead on Arrivial",Carolyn Keene,1,General Knowledge
"A Nancy Drew and Hardy Boys Super Mystery, Tropic of Fear",Carolyn Keene,3,General Knowledge
A Nation Torn,Delia Ray,1,General Knowledge
A New Coat for Anna,Harriet Ziefert,1,General Knowledge
A New True Book: The Mohawk,Jill Duval,1,General Knowledge
A New True Book: The Seminole,Jill Duval,1,General Knowledge
a newbery halloween,"martin h greenberg, charles g waugh",1,General Knowledge
A Novel of Pearl Harbor,Harry Mazer,2,Literature
A Picture Book of Abraham Lincoln,David A. Adler,3,General Knowledge
A Picture Book of christopher Colombus,David A. Adler,1,General Knowledge
a picture book of christopher columbus,david adler,1,General Knowledge
A Picture Book of Davy Crockett,David A. Adler,1,General Knowledge
A Picture Book of George Washington,David A. Adler,1,General Knowledge
A Picture Book of John F. Kennedy,David A. Adler,1,General Knowledge
A Pizza the Size of the Sun,Jack Prelutsky,1,General Knowledge
A pocket for corduroy,Dontreeman,1,General Knowledge
A Pocket Full of Kisses,Audrey Penn,1,General Knowledge
A Pocket Full of Kisses,Audry Penn,1,General Knowledge
"A Poison Apple Book, Curiosity Killed the Cat",Sierra Harimann,1,General Knowledge
"A Poison Apple Book, Her Evil Twin",Mimi McCoy,3,General Knowledge
A pony for a princess,Andrea Posner-Sanchez,1,General Knowledge
A promise at the Alamo,"Dorothy Hobbler, Thomas Hobbler",1,General Knowledge
"A Promise at the Alamo, The Story of a Texan Girl","Thomas and Dorothy Hoobler, Carey-Greenberg Associates",1,Literature
a promising day,sr baecker,1,General Knowledge
A Raft Of Sea Otters,Vicki León,1,General Knowledge
"A Raft of Sea Otters, An Affectionate Portrait",Vicki Leon,1,General Knowledge
A Rainbow of My Own,Don Treeman,1,General Knowledge
a read alound story noahs big boat,ella lindball,1,Literature
A Really Popular Girl,Kathryn Ewing,1,General Knowledge
A Reward For Josefina,Valerie Tripp,1,General Knowledge
A Rootin' Tootin' Cowgirl,M.L. Dunham,1,General Knowledge
A Season of Gifts,Richard Peck,1,General Knowledge
a series of of unfortunate events the ersatz elevator,lemony snicket,2,General Knowledge
"A Series of Unfortnuate Events, The Carnivorous Carnival",Lemony Snicket,1,General Knowledge
a series of unfortunate events,lemony snicket,1,General Knowledge
A Series of Unfortunate Events - The Bad Beginning,Lemony Snicket,1,General Knowledge
A Series of Unfortunate Events - The Grim Grotto,Lemony Snicket,1,General Knowledge
A Series of Unfortunate Events - The Slippery Slope,Lemony Snicket,1,General Knowledge
a series of unfortunate events the austere academy,lemony snicket,1,General Knowledge
a series of unfortunate events the bad beginning,lemony snicket,1,General Knowledge
A Series of Unfortunate Events The Carnivorous Carnival,Lemony Snicket,2,General Knowledge
a series of unfortunate events the end,lemony snicket,1,General Knowledge
a series of unfortunate events the grim grotto,lemony snicket,1,General Knowledge
A Series of Unfortunate Events The Hostile Hospital,Lemony Snicket,3,General Knowledge
A Series of Unfortunate Events The Miserable Mill,Lemony Snicket,2,General Knowledge
a series of unfortunate events the penultimate peril,lemony snicket,1,General Knowledge
a series of unfortunate events the slippery slope,lemony snicket,1,General Knowledge
a series of unfortunate events the vile village,lemony snicket,1,General Knowledge
a series of unfortunate events the wide window,lemony snicket,1,General Knowledge
a sick day for amos mcgee,philip stead,1,General Knowledge
A Single Shard,Linda Sue Park,3,General Knowledge
A Smart Girl's Guide to Freindship Troubles,Patti Kelly Criswell,1,Arts and Recreation
A Smart Girl's Guide to Friendship Troubles,Patti Kelley Criswell,3,Arts and Recreation
A Smart Girl's Guide to Manners,Nancy Holyoke,2,Arts and Recreation
A Smart Girl's Guide to Starting Middle School,Julie Williams,1,Arts and Recreation
A Smart Girls guide to sticky situations,American Girl,1,Arts and Recreation
A Snowman Named just Bob,Mark Kimball Moulton,1,General Knowledge
A Squash and a Squeeze,Julia Donaldson,1,General Knowledge
A Story A Story,Gail E. Haley,1,Literature
"A Street Through Time a 12,000-Year Walk Through History",Steven Noon,1,Literature
a string in the harp,nancy bond,1,General Knowledge
A Strong Right Arm,Michelle Y. Green,2,General Knowledge
A Summer to Die,Lois Lowry,1,General Knowledge
A Swiftly Tilting Planet,Madeleine L'engle,2,Science
A Swim through the Sea,Kristin Joy Pratt,1,General Knowledge
A Tale For Easter,Jasha judos,1,Literature
A taste of Blackberries,Doris Buchanan Smith,3,General Knowledge
A Terrifying Taste of Short & Shivery,Robert D. San Souce,1,General Knowledge
a time of angels,karen hesse,1,General Knowledge
a time to love,walter myers,1,General Knowledge
A to Z Mysteries - The Bald Bandit,Ron Roy,1,General Knowledge
A to Z Mysteries The Runaway Racehorse,Ron Roy,1,General Knowledge
A to Z Mysteries: The Deadly Dungeon,Ron Roy,1,General Knowledge
A to Z Mysteries: The Goose’s Gold,Ron Roy,1,General Knowledge
A Treasury of Paddington,Michael Bond,1,General Knowledge
A Treasury of Stories from Around the World,Linda Jennings (editor),1,Literature
A Tree is Nice,Janice May Udry,1,General Knowledge
A Trip to the Dcotor,Deborah Lock,1,General Knowledge
A Very Scary Haunted House,Joanne Barkan,3,General Knowledge
A Very Special Kwanzaa,Debbi Chocolate,1,General Knowledge
A Village Full of Valentines,James Stevenson,1,General Knowledge
"A Visit from St. Nicholas and Santa Mouse, Too!",Clement C. Mouse,1,General Knowledge
A Voice of Her Own,Kathryn Lasky,1,General Knowledge
A Walk in the Rainforest,Kristin Joy Pratt,1,General Knowledge
a williamsburg household,joan anderson,1,General Knowledge
A Wind in the Door,Madeleine L'Engle,1,General Knowledge
"A Winnie the Pooh First Reader, Rabbit Gets Lost",Isabel Gaines,1,General Knowledge
A World War Two Submarine,"Richard Humble, Mark Bergin",1,General Knowledge
A Wrinkle In Time,Madeline L'Engle,2,General Knowledge
A Wrinkle In Time,Madeline L.'Engle,3,General Knowledge
A Wrinkley In Time,Madeleine L'ENGLE,1,General Knowledge
A Year Down Yonder,Richard Peck,2,General Knowledge
A Young Patriot,Jim Murphy,1,General Knowledge
Abandoned! Will She Ever Find Home?,Jenmny Dale,1,General Knowledge
ABC,Dr. Seuss,1,General Knowledge
Abduction,"Rodman Philbrick, Lynn Harnett",1,General Knowledge
Abe Lincoln - President for the People,Yannick Oney,1,General Knowledge
Abe Lincoln The Young Years,Keith Brandt,1,General Knowledge
Abe Lincoln: The boy who loved books,Kay Winters,1,General Knowledge
Abe Lincoln: The Young Years,Keith Brandt,2,General Knowledge
Abiyoyo,Pete Seeger,1,General Knowledge
About Weather,M. Jean Craig,1,Science
Abraham Lincoln,Ingri & Edgar Parin d'Aulaire,1,General Knowledge
Abraham Lincoln,Ingri&Edgar Parin D'Aulaire,1,General Knowledge
Abraham Lincoln and Presidents' Day,Joanne Barkan,2,General Knowledge
"Abrham Lincoln, Friend of the People",Clara Ingram Judson,1,General Knowledge
Absoltely Nat,Maria Scrivan,2,General Knowledge
Absolutely Nat,Maria Scrivan,1,General Knowledge
Absolutely Normal Chaos,Sharon Creech,1,General Knowledge
absolutley lucy,llene cooper,1,General Knowledge
Absolutly Normal Chaos,Sharon Creech,2,General Knowledge
abuelo y los tres osos,jerry tello,3,General Knowledge
Accidentally Fabulous,Lisa Papademetriou,1,General Knowledge
Acids and Bases,Lynnette Brent,1,General Knowledge
Across Five Aprils,Irene Hunt,3,General Knowledge
Across the Wide and Lonesome Prairie,Kristiana Gregory,1,General Knowledge
Action Optical Illusions,Al Seckel,1,General Knowledge
Adam of the Road,Elizabeth Janet Gray,2,General Knowledge
Addy's Wedding Quilt,Connie Porter,1,General Knowledge
" Adventure Time, Which Way, Dude? BMO's Day Out",Max Brallier,1,General Knowledge
Adventures in Ancient Egypt,Linda Bailey,1,Literature
adventures in bikini bottom,molly reisner kim ostrow,1,Literature
Adventures of Danny and the Dinosaur,Syd Hoff,1,Literature
adventures of huckleberry finn,mark twain,4,Literature
adventures of huckleberry finn,mark twaine,1,Literature
Adventures of Sherlock Holmes,Arthur Conan Dyle,1,Literature
Adventures of the Shark Lady,Ann McGovern,1,Literature
adventures of tom sawyer,mark twaine,1,Literature
Aenir,Garth Nix,1,General Knowledge
Africa complete story of the continent,norman lobsenz,1,Literature
african traditions,margaret musgrove,1,General Knowledge
"After Fifth Grade, The World!",Claudia Mills,1,General Knowledge
After the Dancing Days,Margaret I. Rostkowski,1,General Knowledge
After the Holocaust,Howard Greenfield,1,General Knowledge
Afternoon of the Elves,Janet Taylor Lisle,2,General Knowledge
"Again, Joseeina!",Valerie Tripp,1,General Knowledge
Against the odds Shark Bite,Todd Strasser,1,General Knowledge
"Ahoy There, Little Polar Bear",Hans de Beer,1,General Knowledge
Al Capone,Diane Yancey,1,General Knowledge
Al Capone Does my Shirts,Gennifer Choldenko,1,General Knowledge
"Al Capone Shines My Shoes, Another Tale from Alcatraz",Gennifer Choldenko,3,Literature
Aladdin,Rosalind Kerven,1,General Knowledge
Aladdin and the Magic Lamp,Deborah Hautzig,1,Arts and Recreation
Albert Einstein - Creative Genius,"Laurence Santrey, Joanne Mattern",1,General Knowledge
Albert Einstein and the Theory of Relativity,Robert Cwilik,1,General Knowledge
"Albert Einstein, and the Theory of Relativity",Robert Cwiklik,1,General Knowledge
"Albert Einstein, Creative Genius",Joanna Mattern & Laurence Santryy,1,General Knowledge
Albie the Lifeguard,Louise Borden,1,General Knowledge
Alexander and the Dragon,Katharine Holabird,1,General Knowledge
Alexander and the terrible horrible no good very bad day,judith viorst,1,General Knowledge
"Alexander and the Terrible, Horrible, No Good, Very Bad Day",Judith Viorst,2,General Knowledge
alexander and the wind up mouse,leo lionn,2,General Knowledge
Alexander and the Wind-Up Mouse,Leo Lionni,1,General Knowledge
Alexander the great,katie marsico,1,General Knowledge
"Alexander, Who Used to be Rich Last Sunday",Ray Cruz,1,General Knowledge
"Alexander, Who's Not (Do you hear me? I mean it!) Going to Move",Judith Viorst,1,General Knowledge
alice and the birthday giant,john f green,1,General Knowledge
"Alice Diary, Living with Diabetes",Marie Gibson,1,Literature
alice in the wonderland,walt disney,1,General Knowledge
Alice in Wonderland,Lewis Caroll,2,General Knowledge
alice in wonderland,lewis carrol,1,General Knowledge
Alice on the Island A Pearl Harbor Story,Mayumi Shimose Poe,3,Literature
Alice Ramsey’s Grand Adventure,Don Brown,1,General Knowledge
Alice's Adventures in Wonderland,Lewis Carroll,1,Literature
Aliens,Jacqueline Mitton,2,General Knowledge
Aliens Ate My Homework,Bruce Coville,2,General Knowledge
Aliens Don't Wear Braces,Debbie Dadey,1,General Knowledge
All ABout Corduroy,Dontreeman,1,General Knowledge
All About Holldiays,Kathleen kain,1,General Knowledge
All About Mechanical Engineering,Don Herweck,1,Technology
All About Niagara Falls,Linda Granfield,1,General Knowledge
All About Sound,Melvin Berger,1,General Knowledge
All in One Piece,Jill Murphy,1,General Knowledge
all kinds of ships,seymour reit,1,General Knowledge
All Night Near The Water,Jim Arnosky,1,General Knowledge
All The Places to Love,Patricia MacLachlan,1,General Knowledge
All the World,Liz Garton Scanlon,1,General Knowledge
All- American Girl,Meg Cabot,1,General Knowledge
All-of-a-Kind Family,Sidney Taylor,1,General Knowledge
Alligator Baby,Robert Munsch,2,General Knowledge
Allosaurus,Ron Wilson,1,General Knowledge
"Almost Gone, The World's Rarest Animals",Steve Jenkins,1,Science
Almost Starring Skinnybonex,Barbara Park,1,General Knowledge
Aloha Means Come Back,"Dorothy Hobbler, Thomas Hobbler",1,General Knowledge
Aloha Means Come Back,"Dorothy Hoobler, Thomas Hoobler",1,General Knowledge
"Altogether, one AT A Time",E.L. Konigsburg,2,General Knowledge
altoona baboona,janie bynum,1,General Knowledge
Always,Ann Scott,1,General Knowledge
Always and Forever,Lurlene McDaniel,3,General Knowledge
always in my heart,m.l. dunham,1,Arts and Recreation
"Amazinf Earth Adventures, A Kid's Earth Adventures",Chapman Mott & Tessa Hill,1,Literature
amazing aircrafts,seymour simon,1,General Knowledge
Amazing Animals Question & Answer Book,"Judy Braus, Jody Marshall, Joyce Altman, and Nancy Hitchner",1,Science
Amazing Beetles,John Still,1,General Knowledge
Amazing but True Sports Stories,Phyllis and Zander Hollander,2,Literature
Amazing But True Sports Stories,"Phyllis Hollander, Zander Hollander",1,Literature
Amazing Escapes,Schoolastic,1,General Knowledge
Amazing Grace,"Mary Hoffman, Caroline Binch",1,General Knowledge
Amazing Inventions,Melivn and Gilda Berger,1,General Knowledge
amazing lizards,trevor smith,1,General Knowledge
Amazing Ocean Animal,John Farndon,3,Science
amazing school records,guiness world records,1,General Knowledge
Amazing School REcords,Scholastic,1,General Knowledge
Amazing Space Facts,Dinah L. Moche,1,Science
amazon fever,kathleen zoefeld,1,General Knowledge
Amber Brown Goes Fourth,Paula Danziger,1,General Knowledge
Amber brown is feeling blue,paula danziger,1,General Knowledge
Amber Brown Is Green with Envy,Paula Danziger,1,General Knowledge
Amber Brown is not a Crayon,Paula Danziger,2,General Knowledge
Amber Brown Sees Red,Paula Danziger,1,General Knowledge
Amelia and eleanor go for a ride,Pam Munoz Ryan,1,General Knowledge
Amelia Bedelia,Peggy Parish,5,General Knowledge
Amelia Bedelia and the Baby,Peggy Parish,3,General Knowledge
Amelia Bedelia And the Suprise Shower,Peggy Parish,1,General Knowledge
Amelia Bedelia and the Surprise Shower,Peggy Parish,1,General Knowledge
amelia bedelia bookworm,herman parish,1,General Knowledge
Amelia Bedelia Goes Wild,Herman Parish,1,General Knowledge
Amelia Bedelia’s Family Album,Peggy Parish,1,General Knowledge
Amelia Writes Again,Marissa Moss,3,General Knowledge
America's Fascinating Indian Heritage,Reader's Digest,1,General Knowledge
American Grub,Mark A. Hicks,1,General Knowledge
Among the Barons,Margaret Peterson Haddix,1,General Knowledge
Among the Betrayed,Margaret Peterson haddix,1,General Knowledge
among the hidden,margarent pertson haddix,1,General Knowledge
Among the Hidden,Margaret Peterson Haddis,3,General Knowledge
Among the Hidden,Margaret Peterson Haddix,3,General Knowledge
among the hidden,margret peterson haddix,2,General Knowledge
Among The Impostors,Margaret Peterson Haddix,2,General Knowledge
Amos Fortune Free Man,Elizabeth Yates,1,General Knowledge
"An American Family, Book Six: 1877, The Debt",S.D. Jones,1,General Knowledge
An American Plague,Jim Murphy,1,General Knowledge
An Early American Christmas,Tomie dePaola,1,General Knowledge
An Even Break,Sid Hite,1,General Knowledge
An Indian Winter,Russell Freedman,2,General Knowledge
An Inside Look at the U.S. Navy Seals,Joe Funk,1,General Knowledge
an old fashioned thanksgiving,louisa may alcott,1,General Knowledge
Anansi The Spider,Gerald McDermott,1,General Knowledge
And Now Miguel,Joseph Krum,1,General Knowledge
"And Now, A Word from Our Sponsor","Thomas Hoobler, Dorothy Hoobler",2,General Knowledge
And So they Build,Bert Kitchen,2,General Knowledge
andersen,hans christian,1,General Knowledge
Andrew's Loose Tooth,Robert Munsch,1,General Knowledge
andy and the lion,james daugherty,1,General Knowledge
Andy Shane and the Pumpkin Trick,Jennifer Richard Jacobson,1,Arts and Recreation
Angel of Hope,Lurlene McDaniel,1,General Knowledge
Angelina and the Butterfly,Katherine Holabird,1,General Knowledge
Angelina and the Rag Doll,Katharine Holabird,1,General Knowledge
Angelina Ballerina,Helen Craig,1,General Knowledge
Angelina's Lucky Penny,Katharine Holabird,1,General Knowledge
Animal Action,Karen Pandell,1,Science
Animal Families,Gene S. Stuart,1,Science
Animal Farm,George Orwell,2,Science
Animal friends,Scholastic,1,Science
Animal Grossology,Sylvia Branzei,2,Science
Animal Kingdom,Danbury Press,1,Science
"Animal Lives, Snakes",Sally Morgan,1,Science
Animal Males and Females,Renne,1,Science
Animal Parade,Chriatine Ricci,1,Science
Animals and Nature,Janine Amos,2,Science
Animals Exposed! The Truth About Animal Senses,"Bernard Stonehouse, Ester Bertram",1,Science
Animals Here and There,D.H. Buchanan,1,Science
Animals in Danger,Field Enterprises,1,Science
Animals in SUMMER,National Geographic,1,Science
Animals that Glow,Judith Presnall,1,Science
"Animals Under Threat, Orangutan",David Orme,1,Science
Animals Without Backbones,Elaine Pascoe,1,Science
Animals/Animals:CAMELS,Judith Jango-Cohen,1,Science
animlas at play,k.m kostyal,1,General Knowledge
animlas that live in trees,scholastic,1,General Knowledge
Animorphs The Proposal,Schoolastic,1,General Knowledge
"Animorphs, The Escape",K.A. Applegate,1,General Knowledge
Animorphs: The Visitor,K.A. Apple,1,General Knowledge
Anipao,Jamake Highwater,1,General Knowledge
Anklyosaurus,Mike Brown,1,General Knowledge
Ankylosaurus,Rupert Oliver,1,General Knowledge
Anmals of the High Mountains,Justin E. Rinard,1,General Knowledge
Anna Is Still Here,Ida Vos,1,General Knowledge
Anna of Byzantium,Tracy Barrett,1,General Knowledge
Anne and the Old One,Miska Miles,1,General Knowledge
Anne Frank,Richard Tames,1,General Knowledge
Anne Frank,Susanna Davidson,1,General Knowledge
Anne Frank - Beyond the Diary,"Ruud van der Rol, Rian Verhoeven",1,Literature
Anne Frank In The World,Anne Frank House,1,General Knowledge
Anne of Green Gables,L. M. Montgomery,1,General Knowledge
Anne of green Gables,L.M. Montgomery,2,General Knowledge
Anne of Green Gables,M. C. Helldorfer,1,General Knowledge
Annie and the Wild Animals,Jan Brett,3,Science
Annie John,Jamaica Kincaid,1,General Knowledge
Antarctic Adventure,Meridth Hooper,1,General Knowledge
Antartica,Carol Barkin,1,Arts and Recreation
Anti Venom,Michael Anthony Steele,1,General Knowledge
Antihero,Kate Karyus Quinn & Demitria Lunetta,3,General Knowledge
"Antler, Bear, Canoe",Besty Bowen,1,General Knowledge
"Antler, Bear, Canoe, A Northwoods Alphabet Year",Betsy Bowen,1,General Knowledge
Antsy Does Time,Neal Shusterman,1,General Knowledge
any small goodness,tony johnson,1,General Knowledge
Anything But Typical,Nora Raleigh Baskin,1,General Knowledge
Apollo 11 Mmoon Landing,Thomas K. Adamson,3,General Knowledge
apollo 11 moon landing,thomas k. adamson,6,General Knowledge
Apple Island or The Truth About Teachers,Douglas Evans,1,General Knowledge
April Foolishness,Teresa Bateman,1,General Knowledge
April’s Kittens,Clare Turlay Newberry,1,General Knowledge
Aquamarine,Alice Hoffman,2,General Knowledge
Araminta Spookie,Frognapped,1,General Knowledge
Arctic Babies,Kathy Darling,1,General Knowledge
Are You  Spider,Judy Allen and Tudor Humphire,1,General Knowledge
Are you a Ladybug,Judy Allen,1,General Knowledge
Are you a Snail?,Judy Allen and Tudor Humphries,1,General Knowledge
Are You My Mother?,P.D. Eastman,2,General Knowledge
are you there god its me margret,judy blume,1,Religion
Aremis Fowl: The Opal Deception,Eoin,1,General Knowledge
Ark Angel,Anthony Horowitz,1,General Knowledge
armadillo rodeo,jan brett,1,General Knowledge
armageddon summer,jane yolen and bruce coville,1,General Knowledge
armagedon summer,jane volen,2,General Knowledge
Armies,Walter Retan,1,General Knowledge
Armor,Charlotte and David Yue,1,General Knowledge
Around and About Udner the sea,Annita Ganiri and Jacky Wood,1,General Knowledge
Around the World in Eighty Days,Jules Verne,2,General Knowledge
Arrow to the Sun,Gerald McDermott,2,General Knowledge
Artemis Fowl,Eoin Colfer,3,Arts and Recreation
